Compte ,Client ,Secteurs Statistique,Catégorie,Secteurs clients,Consolidation Client,Gouvernorat
394380,NABIL DALHOUMI CITE EL ARICH KASSERINE,DEPOSITAIRES,DEPOSITAIRES,DEPOSITAIRES,NABIL DALHOUMI,KASSERINE
394390,NABIL DALHOUMI CITE EL ARICH KASSERINE,DEPOSITAIRES,DEPOSITAIRES,DEPOSITAIRES,NABIL DALHOUMI,KASSERINE
394400,NABIL DALHOUMI CITE EL ARICH KASSERINE,DEPOSITAIRES,DEPOSITAIRES,DEPOSITAIRES,NABIL DALHOUMI,KASSERINE
394410,NABIL DALHOUMI CITE EL ARICH KASSERINE,DEPOSITAIRES,DEPOSITAIRES,DEPOSITAIRES,NABIL DALHOUMI,KASSERINE
394420,MABROUK HAMDI CITE EL ARICH KASSERINE,DEPOSITAIRES,DEPOSITAIRES,DEPOSITAIRES,MABROUK HAMDI,KASSERINE
394430,MABROUK HAMDI CITE EL ARICH KASSERINE,DEPOSITAIRES,DEPOSITAIRES,DEPOSITAIRES,MABROUK HAMDI,KASSERINE
394440,REFRACTAIRES DE TUNISIE FILIALE CERAMIQUE TUNISIENNE LA PECHERIE BIZERTE,INDUSTRIEL GAZ,INDUSTRIEL GAZ,INDUSTRIEL GAZ,REFRACTAIRES DE TUNISIE FILIALE CERAMIQUE TUNISIENNE,BIZERTE
394460,RESTAURANT UNIVERSITAIRE EL WAHAT CITE EL AMEL ZRIG GABES,EDUCATION NATIONALE,ADMINISTRATION,MIN.ENS.SUP.RECH.SC.,RESTAURANT UNIVERSITAIRE EL WAHAT,GABES
394470,MABROUK HAMDI CITE EL ARICH KASSERINE,DEPOSITAIRES,DEPOSITAIRES,DEPOSITAIRES,MABROUK HAMDI,KASSERINE
394490,MABROUK HAMDI CITE EL ARICH KASSERINE,DEPOSITAIRES,DEPOSITAIRES,DEPOSITAIRES,MABROUK HAMDI,KASSERINE
394510,MONGI SEDIRI CITE EZZOUHOUR GHARDIMAOU JENDOUBA,DEPOSITAIRES,DEPOSITAIRES,DEPOSITAIRES,MONGI SEDIRI,JENDOUBA
394520,AMEN SERVICE GAZ S/S AGIL CARBURATION AUTO RTE DE GABES KM4 CEINTURE CITE EL HABIB SFAX,GPL C,GPL C,GPL C,CITE EL HABIB - SFAX GPL,SFAX
394530,HOUCINE AYARI AV.7NOVEMBRE ROUHIA SBIBA KASSERINE,DEPOSITAIRES,DEPOSITAIRES,DEPOSITAIRES,HOUCINE AYARI,KASSERINE
394540,CITE UNIVERSITAIRE IBN KHALDOUN SIDI BOUZID CITE UNIVERS IBN KHALDOUN B.P 368 SIDI BOUZID,EDUCATION NATIONALE,ADMINISTRATION,MIN.ENS.SUP.RECH.SC.,CITE UNIVERSITAIRE IBN KHALDOUN,SIDI BOUZID
394550,MONCEF LAGHA S/S AGIL TEBOULBOU GABES,DEPOSITAIRES,DEPOSITAIRES,DEPOSITAIRES,MONCEF LAGHA,GABES
394560,MAHER EL GHALI 292.AV HABIB BOURGUIBA TEBOULBA MONASTIR,DEPOSITAIRES,DEPOSITAIRES,DEPOSITAIRES,MAHER EL GHALI,MONASTIR
394570,KAMEL DINARI CITE ESSAADA METLAOUI GAFSA,DEPOSITAIRES,DEPOSITAIRES,DEPOSITAIRES,KAMEL DINARI,GAFSA
394580,SOTRAMA S/S AGIL BEN GUERDANE MEDENINE,DEPOSITAIRES,DEPOSITAIRES,DEPOSITAIRES,SOTRAMA,MEDENINE
394590,ANOUAR BEN MOHAMED JERY RTE DE TATAOUINE BEN GUERDANE OUEST MEDENINE,DEPOSITAIRES,DEPOSITAIRES,DEPOSITAIRES,ANOUAR BEN MOHAMED JERY,TATAOUINE
394600,CHAKER BEN BELGACEM DHAOUI 29.RUE MED ALI CITE EL KHADRA SIDI BOUZID,DEPOSITAIRES,DEPOSITAIRES,DEPOSITAIRES,CHAKER BEN BELGACEM DHAOUI,SIDI BOUZID
394610,BRAHIM BEL MABROUK KEBILI,DEPOSITAIRES,DEPOSITAIRES,DEPOSITAIRES,BRAHIM BEL MABROUK,KEBILI
394640,HAMMADI M'HAT MENZEL HAMZA - BOUMARDES (GOUVERN DE MAHDIA,DEPOSITAIRES,DEPOSITAIRES,DEPOSITAIRES,HAMMADI M'HAT,MAHDIA
394650,MAHER EL GHALI 292.AV HABIB BOURGUIBA TEBOULBA MONASTIR,DEPOSITAIRES,DEPOSITAIRES,DEPOSITAIRES,MAHER EL GHALI,MONASTIR
394660,LYCEE SECONDAIRE ENNADHOUR LYCEE SECONDAIRE ENNADHOUR ZAGHOUAN,COLLEGE-LYCEE-ECOLE,ADMINISTRATION,MIN.EDUC.,LYCEE SECONDAIRE ENNADHOUR,ZAGHOUAN
394680,RACHIDA BENT AYADI TRABOLSIA TARF CHNA BOUARADA SILIANA,DEPOSITAIRES,DEPOSITAIRES,DEPOSITAIRES,RACHIDA BENT AYADI TRABOLSIA,ZAGHOUAN
394710,SOTRAMA S/S AGIL BEN GUERDANE MEDENINE,DEPOSITAIRES,DEPOSITAIRES,DEPOSITAIRES,SOTRAMA,MEDENINE
394720,RESTAURANT UNIVERSITAIRE DE MEDENINE RESTAURANT UNIVERS EL FJA_BOUGRARA MEDENINE,EDUCATION NATIONALE,ADMINISTRATION,MIN.ENS.SUP.RECH.SC.,RESTAURANT UNIVERSITAIRE DE MEDENINE,MEDENINE
394730,DORCAS NUTRITION N93 CITE EL MONA NOUVELLE MEDINA BEN AROUS,INDUSTRIEL GAZ,INDUSTRIEL GAZ,INDUSTRIEL GAZ,DORCAS NUTRITION,BEN AROUS
394740,SOCIETE EL WAFA DE DISTRIBUTION DE GAZ AVENUE HABIB THAMEUR SBIBA KASSERINE,DEPOSITAIRES,DEPOSITAIRES,DEPOSITAIRES,SOCIETE EL WAFA DE DISTRIBUTION DE GAZ,KASSERINE
394760,RESTAURANT UNIVERSITAIRE IBN ROCHD KAIROUAN CAMPUS UNIVERSITAIRE RAKADA KAIROUAN,EDUCATION NATIONALE,ADMINISTRATION,MIN.ENS.SUP.RECH.SC.,RESTAURANT UNIVERSITAIRE IBN ROCHD,KAIROUAN
394770,CASERNE DJEBEL AMMAR DTION DE TRANSM CASERNE BAB SAADOUN EL OMRANE,ARMEE GAZ,ADMINISTRATION,MIN.DEF.NAT.,CASERNE BAB SAADOUN EL OMRANE,ARIANA
394780,"HOTEL ITROPECA -BEACH SIDI REZIG, RUE DE L'ECOLE 2033 BEN AROUS",HOTELS-RESTAURANTS,HOTELS-RESTAURANTS,HOTELS-RESTAURANTS,HOTEL ITROPECA,JENDOUBA
394790,ISET JENDOUBA,EDUCATION NATIONALE,ADMINISTRATION,MIN.ENS.SUP.RECH.SC.,ISET JENDOUBA,JENDOUBA
394800,SOCIETE EL WAFA DE DISTRIBUTION DE GAZ AVENUE HABIB THAMEUR SBIBA KASSERINE,DEPOSITAIRES,DEPOSITAIRES,DEPOSITAIRES,SOCIETE EL WAFA DE DISTRIBUTION DE GAZ,KASSERINE
394810,MATEC INTERNATIONAL S.A.R.L ZONE FRANCHE SITE 2 MENZEL BOURGUIBA BIZERTE,INDUSTRIEL GAZ,INDUSTRIEL GAZ,INDUSTRIEL GAZ,MATEC INTERNATIONAL S.A.R.L,BIZERTE
394810,METEC INTERNATIONAL S.A.R.L ZONE FRANCHE SITE 2 MENZEL BOURGUIBA BIZERTE,INDUSTRIEL GAZ,INDUSTRIEL GAZ,INDUSTRIEL GAZ,MATEC INTERNATIONAL S.A.R.L,BIZERTE
394821,LYCEE DAR EL AMEN KAIROUAN,EDUCATION NATIONALE,ADMINISTRATION,MIN.EDUC.,LYCEE DAR EL AMEN,KAIROUAN
394830,REGIMENT DU QUARTIER GENERAL EL OMRANE TUNIS,ARMEE GAZ,ADMINISTRATION,MIN.DEF.NAT.,REGIMENT DU QUARTIER GENERAL EL OMRANE,TUNIS
394860,CHARFI MED EL HEDI STATION AGIL CARBURATION AUTO ROUTE DE HAMMA TOZEUR,GPL C,GPL C,GPL C,TOZEUR ,TOZEUR
394870,DOTATION STOCK STATION SERVICE AGIL CITE OLYMPIQUE TUNIS,REVENDEVEUR,REVENDEVEUR,REVENDEVEUR,DOTATION STOCK STATION SERVICE AGIL CITE OLYMPIQUE TUNIS,MAHDIA
394890,ISMAIL BEN OTHMAN KARAOUILI S/S ESSO GAFSA,DEPOSITAIRES,DEPOSITAIRES,DEPOSITAIRES,ISMAIL BEN OTHMAN KARAOUILI,GAFSA
394900,"CHAKER BEN BELGACEM DHAOUI 29,RUE MED ALI CITE EL KHADRA SIDI BOUZID",DEPOSITAIRES,DEPOSITAIRES,DEPOSITAIRES,CHAKER BEN BELGACEM DHAOUI,SIDI BOUZID
394910,MOHAMED MNIF BP 90 SIDI ABBES SFAX,DEPOSITAIRES,DEPOSITAIRES,DEPOSITAIRES,MOHAMED MNIF,SFAX
394930,SOCIETE AMEN SERVICE GAZ ROUTE DE L'AEROPORT KM 1.5 SFAX,DEPOSITAIRES,DEPOSITAIRES,DEPOSITAIRES,SOCIETE AMEN SERVICE GAZ,SFAX
394940,ISMAIL BEN OTHMAN KARAOUILI S/S ESSO GAFSA,DEPOSITAIRES,DEPOSITAIRES,DEPOSITAIRES,ISMAIL BEN OTHMAN KARAOUILI,GAFSA
394960,HASSEN BOULARES RUE TAREK IBN ZIAD CARTHAGE,DEPOSITAIRES,DEPOSITAIRES,DEPOSITAIRES,HASSEN BOULARES,TUNIS
395020,CENTRE MILITAIRE LES CANINES CENTRE MILITAIRE LES CANINES NADHOUR.BIZERTE,ARMEE GAZ,ADMINISTRATION,MIN.DEF.NAT.,CENTRE MILITAIRE CANIN,BIZERTE
395060,RESTAURANT UNIVERSITAIRE KEBILI,EDUCATION NATIONALE,ADMINISTRATION,MIN.ENS.SUP.RECH.SC.,RESTAURANT UNIVERSITAIRE KEBILI,KEBILI
395080,RIDHA LAGHA SIDI DAOAD GABES,DEPOSITAIRES,DEPOSITAIRES,DEPOSITAIRES,RIDHA LAGHA,GABES
395090,FOYER UNIVERSITAIRE KEBILI,EDUCATION NATIONALE,ADMINISTRATION,MIN.ENS.SUP.RECH.SC.,FOYER UNIVERSITAIRE KEBILI,KEBILI
395100,MAHMOUD BEN MOHAMED MOKHTAR AMMARI SIDI ALI BEN KHALIFA JERISSA LE KEF,DEPOSITAIRES,DEPOSITAIRES,DEPOSITAIRES,MAHMOUD BEN MOHAMED MOKHTAR AMMARI,LE KEF
395120,MAHMOUD BEN MOHAMED MOKHTAR AMMARI CITE ALI BEN KHALIFA JERISSA LE KEF,DEPOSITAIRES,DEPOSITAIRES,DEPOSITAIRES,MAHMOUD BEN MOHAMED MOKHTAR AMMARI,LE KEF
395140,AMOR BEN BOUKTHIR BELGACEM KAOUALA HACHICHINA GHRAIBA SFAX,DEPOSITAIRES,DEPOSITAIRES,DEPOSITAIRES,AMOR BEN BOUKTHIR BELGACEM KAOUALA,SFAX
395150,SOCIETE EL BARAKA CITE EL AMEL Z.I METLAOUI GAFSA,DEPOSITAIRES,DEPOSITAIRES,DEPOSITAIRES,SOCIETE EL BARAKA,GAFSA
395160,SOCIETE EL BARAKA CITE EL AMEL Z.I METLAOUI GAFSA,DEPOSITAIRES,DEPOSITAIRES,DEPOSITAIRES,SOCIETE EL BARAKA,GAFSA
395170,SOCIETE DE SERVICE NAMANI S/S AGIL MERETH ROUTE DE GABES KM.2 MERETH EL ARGOUB,GPL C,GPL C,GPL C,MARETH,GABES
395190,EL AZIZ EL ALOUI 14 RUE 103 CITE ETTADHAMEN TUNIS,REVENDEVEUR,REVENDEVEUR,REVENDEVEUR,EL AZIZ EL ALOUI,ARIANA
395210,HOTEL LAICO ZONE TOURISTIQUE AGHIR DJERBA,HOTELS-RESTAURANTS,HOTELS-RESTAURANTS,HOTELS-RESTAURANTS,HOTEL LAICO,MEDENINE
395220,ABDELLATIF LAHBIB 10.RUE IBN JAZZAR EL ALIA BIZERTE,DEPOSITAIRES,DEPOSITAIRES,DEPOSITAIRES,ABDELLATIF LAHBIB,BIZERTE
395240,71 REGIMENT DE TRANSMISSION OUED ELLIL,ARMEE GAZ,ADMINISTRATION,MIN.DEF.NAT.,71 REGIMENT DE TRANSMISSION OUED ELLIL,ARIANA
395270,LYCEE TEJEROUINE LYCEE TEJEROUINE LE KEF,COLLEGE-LYCEE-ECOLE,ADMINISTRATION,MIN.EDUC.,LYCEE TEJEROUINE,LE KEF
395300,BRIGADE DE L'ORDRE PUBLIQUE BP 6071 EL AOUINET GABES,ADMINISTRATION GAZ,ADMINISTRATION,MIN.INTER.DEV.LOC.,BRIGADE DE L'ORDRE PUBLIQUE,GABES
395320,ECOLE PREPARATOIRE DE MENZEL M'HERI MENZEL M'HERI NASRALLAH KAIROUAN,COLLEGE-LYCEE-ECOLE,ADMINISTRATION,MIN.EDUC.,ECOLE PREPARATOIRE DE MENZEL M'HERI,KAIROUAN
395330,TOPEKA PARC D'ACTIVITE ECONOMIQUE MENZEL BOURGUIBA,INDUSTRIEL GAZ,INDUSTRIEL GAZ,INDUSTRIEL GAZ,TOPEKA,BIZERTE
395340,ECOLE PREPARATOIRE DE ZHENA ZHENA UTIQUE,COLLEGE-LYCEE-ECOLE,ADMINISTRATION,MIN.EDUC.,ECOLE PREPARATOIRE DE ZHENA,BIZERTE
395360,HASSEN BOULARES RUE TAREK IBN ZIAD CARTHAGE,DEPOSITAIRES,DEPOSITAIRES,DEPOSITAIRES,HASSEN BOULARES,TUNIS
395410,INSTITUT NATIONAL AGRONOMIQUE DE TUNISIE 43.AV CHARLES NICOLES CITE EL MAHRAGENE TUNIS,COLLEGE-LYCEE-ECOLE,ADMINISTRATION,MIN.AGRIC.ENV.RESS.HYD.,INSTITUT NATIONAL AGRONOMIQUE DE TUNISIE,TUNIS
395440,FOYER UNIVERSITAIRE EL FJAA FOYER UNIVERS EL FJAA.KM24.MEDENINE.EL.JORF,EDUCATION NATIONALE,ADMINISTRATION,MIN.ENS.SUP.RECH.SC.,FOYER UNIVERSITAIRE EL FJAA,MEDENINE
395450,SOCODIPP 315 CITE ERRAYAHINE AP.B EL MANAR3 - TUNIS,DEPOSITAIRES,DEPOSITAIRES,DEPOSITAIRES,SOCODIPP,ZAGHOUAN
395470,SOCIETE NEAPOLIS 22.RUE SIDI ALI AZZOUZ NABEUL,DEPOSITAIRES,DEPOSITAIRES,DEPOSITAIRES,SOCIETE NEAPOLIS,NABEUL
395500,LYCEE EL FARABI LYCEE EL FARABI EL FAHS ZAGHOUAN,COLLEGE-LYCEE-ECOLE,ADMINISTRATION,MIN.EDUC.,LYCEE EL FARABI,ZAGHOUAN
395510,S.T.E HAJJI SERVICES REMLA _ KERKENNA _ SFAX,DEPOSITAIRES,DEPOSITAIRES,DEPOSITAIRES,SOCIETE HAJJI SERVICES,SFAX
395520,CITE UNIVERSITAIRE KELIBIA CITE UNIVERSITAIRE OUED EL KHATF KELIBIA,COLLEGE-LYCEE-ECOLE,ADMINISTRATION,MIN.ENS.SUP.RECH.SC.,CITE UNIVERSITAIRE KELIBIA,NABEUL
395530,MAHMOUD BEN MOHAMED MOKHTAR AMMARI CITE ALI BEN KHALIFA JERISSA LE KEF,DEPOSITAIRES,DEPOSITAIRES,DEPOSITAIRES,MAHMOUD BEN MOHAMED MOKHTAR AMMARI,LE KEF
395550,"STE REGIONALE DE COMMERCE ""ECONOMIE DU NORT"" 2.RUE HABIB THAMEUR BEJA",DEPOSITAIRES,DEPOSITAIRES,DEPOSITAIRES,"STE REGIONALE DE COMMERCE ""ECONOMIE DU NORT""",BEJA
395600,A.N.M RECYCLING TUNISIA ZONE INDUSTRIELLE UTIQUE,INDUSTRIEL GAZ,INDUSTRIEL GAZ,INDUSTRIEL GAZ,A.N.M RECYCLING TUNISIA,BIZERTE
395610,ECOLE DE FORMATION GARDE NATIONALE MORNAGUIA MANNOUBA ECOLE DE FORMATION GARDE NATIONALE MORNAGUIA MANNOUBA,COLLEGE-LYCEE-ECOLE,ADMINISTRATION,MIN.DEF.NAT.,ECOLE DE FORMATION GARDE NATIONALE MORNAGUIA,MANOUBA
395620,ISET T.G.M. SARL BEJA ISET T.G.M. SARL BEJA AV. DE L'ENVIRONNEMENT B.P N 244 BEJA,EDUCATION NATIONALE,ADMINISTRATION,MIN.ENS.SUP.RECH.SC.,ISET BEJA,BEJA
395630,FOYER UNIVERSITAIRE RAKADA KAIROUAN FOYER UNIVERSITAIRE RAKADA KAIROUAN,EDUCATION NATIONALE,ADMINISTRATION,MIN.ENS.SUP.RECH.SC.,FOYER UNIVERSITAIRE RAKADA,KAIROUAN
395640,NEGRESCO HOTEL CLUB BP 220 MIDOUN DJERBA,HOTELS-RESTAURANTS,HOTELS-RESTAURANTS,HOTELS-RESTAURANTS,HOTEL CLUB NEGRESCO,MEDENINE
395651,DIRECTION DU MATERIEL ROULANT ET DES ESSENCES (BUANDERIE) FONDOUK JEDID,ARMEE GAZ,ADMINISTRATION,MIN.DEF.NAT.,DIRECTION DU MATERIEL ROULANT ET DES ESSENCES (BUANDERIE),NABEUL
395660,CENTRE REGIONAL DE L'EDUCATION ET DE FORMATION CONTINUE RUE DU 1ER MAI BIZERTE,COLLEGE-LYCEE-ECOLE,ADMINISTRATION,MIN. DE LA F.P ET DE L'EMPLOI,CENTRE REGIONAL DE L'EDUCATION ET DE FORMATION CONTINUE,BIZERTE
395670,ISET SIDI BOUZID ISET SIDI BOUZID ROUTE DE GAFSA B.P N 377 SIDI BOUZID,EDUCATION NATIONALE,ADMINISTRATION,MIN.ENS.SUP.RECH.SC.,ISET SIDI BOUZID,SIDI BOUZID
395680,SOCIETE TOURISTIQUE IMMOBILIERE HOTEL LELLA MERIAM AV.FARHAT HACHED IMMEUBLE MAJED ZARZIS,HOTELS-RESTAURANTS,HOTELS-RESTAURANTS,HOTELS-RESTAURANTS,HOTEL LELLA MERIAM,MEDENINE
395690,AMEN SERVICE GAZ (STATION SERVICE AGIL CARBURATION AUTO ) RTE DE GABES KM.4 CEINTURE CITE ELHABIB SFAX,GPL C,GPL C,GPL C,CITE EL HABIB - SFAX GPL,SFAX
395700,INSTITUT SUPERIEUR TECHNOLOGIQUE SIDI THABET INSTITUT SUPERIEUR TECHNOLOGIQUE SIDI THABET,DIVERS GAZ,DIVERS GAZ,DIVERS GAZ,INSTITUT SUPERIEUR TECHNOLOGIQUE SIDI THABET,ARIANA
395710,FOYER UNIVERSITAIRE SILIANA,EDUCATION NATIONALE,ADMINISTRATION,MIN.ENS.SUP.RECH.SC.,FOYER UNIVERSITAIRE SILIANA,SILIANA
395720,CITE UNIVERSITAIRE AMOR KHATTAB AVENUE AMOR KHATTAB GABES,EDUCATION NATIONALE,ADMINISTRATION,MIN.ENS.SUP.RECH.SC.,CITE UNIVERSITAIRE AMOR KHATTAB,GABES
395740,MOHAMED BEN FREJ BEN ABDALLAH 24. AVENUE HABIB BOURGUIBA JEBENIANA SFAX,DEPOSITAIRES,DEPOSITAIRES,DEPOSITAIRES,MOHAMED BEN FREJ BEN ABDALLAH,SFAX
395750,EL AIDI BEN SEBTI MABROUK SENED GARE Z.4 SENED GAFSA,DEPOSITAIRES,DEPOSITAIRES,DEPOSITAIRES,EL AIDI BEN SEBTI MABROUK,GAFSA
395760,"STE NOUVELLE DE MARCHANDISES ""S.N.D.M""",DEPOSITAIRES,DEPOSITAIRES,DEPOSITAIRES,"STE NOUVELLE DE MARCHANDISES ""S.N.D.M""",SILIANA
395770,MOHAMED MNIF SIDI ABBES ROUTE DE GABES KM 3.5 SFAX,DEPOSITAIRES,DEPOSITAIRES,DEPOSITAIRES,MOHAMED MNIF,SFAX
395780,MOUNIR BEN HAMMADI RIAHI CITE EL INBIAATH GOUBELLAT BEJA,DEPOSITAIRES,DEPOSITAIRES,DEPOSITAIRES,MOUNIR BEN HAMMADI RIAHI,ARIANA
395790,SOCIETE AMEN SERVICE GAZ ROUTE DE L'AEROPORT KM 1.5 SFAX,DEPOSITAIRES,DEPOSITAIRES,DEPOSITAIRES,SOCIETE AMEN SERVICE GAZ,SFAX
395810,SOTULUB 8 RUE NOUVELLE DELHI BIZERTE,INDUSTRIEL GAZ,INDUSTRIEL GAZ,INDUSTRIEL GAZ,SOTULUB,BIZERTE
395830,SOCIETE MARETH DISTRIBUTION ET SERVICES AVENUE 27 OCTOBRE MERETH GABES,DEPOSITAIRES,DEPOSITAIRES,DEPOSITAIRES,SOCIETE MARETH DISTRIBUTION ET SERVICES,GABES
395850,AFEF BENT EL HOUCINE AYARI ROUTE JEDILIENNE KM.2 SBIBA KASSERINE,DEPOSITAIRES,DEPOSITAIRES,DEPOSITAIRES,AFEF AYARI,KASSERINE
395860,AFEF BENT EL HOUCINE AYARI ROUTE JEDILIENNE KM.2 SBIBA KASSERINE,DEPOSITAIRES,DEPOSITAIRES,DEPOSITAIRES,AFEF AYARI,KASSERINE
395870,AFEF BENT EL HOUCINE AYARI ROUTE JEDILIENNE KM.2 SBIBA KASSERINE,DEPOSITAIRES,DEPOSITAIRES,DEPOSITAIRES,AFEF AYARI,KASSERINE
395880,SOCIETE EL WIFAK DE DISTRIBUTION ZONE INDUSTRILLE ENFIDHA SOUSSE,DEPOSITAIRES,DEPOSITAIRES,DEPOSITAIRES,SOCIETE EL WIFAK DE DISTRIBUTION,SOUSSE
395890,MINISTERE DE LA DEFENCE CASERNE DE OUDHNA CASERNE DE OUDHNA MOHAMADIA BEN AROUS,ARMEE GAZ,ADMINISTRATION,MIN.DEF.NAT.,CASERNE DE OUDHNA,BEN AROUS
395900,CITE UNIVERSITAIRE IBN JAZZAR ROUTE AERODROME SFAX,EDUCATION NATIONALE,ADMINISTRATION,MIN.ENS.SUP.RECH.SC.,CITE UNIVERSITAIRE IBN JAZZAR,SFAX
395910,SOCIETE ALUCOLOR SOCIETE ALUCOLOR Z .I MEDJEZ EL BAB,INDUSTRIEL GAZ,INDUSTRIEL GAZ,INDUSTRIEL GAZ,SOCIETE ALUCOLOR,BEJA
395920,SOCIETE EL WIFAK DE DISTRIBUTION ZONE INDUSTRILLE ENFIDHA SOUSSE,DEPOSITAIRES,DEPOSITAIRES,DEPOSITAIRES,SOCIETE EL WIFAK DE DISTRIBUTION,SOUSSE
395930,HASSEN BEN MONGI SEDIRI AV. HABIB BOURGUIBA GHARDIMAOU JENDOUBA,DEPOSITAIRES,DEPOSITAIRES,DEPOSITAIRES,MONGI SEDIRI,JENDOUBA
395950,CENTRE DE FORMATION ET DE RECYCLAGE AGRICOLE JAMMEL,EDUCATION NATIONALE,ADMINISTRATION,MIN.ENS.SUP.RECH.SC.,CENTRE DE FORMATION ET DE RECYCLAGE AGRICOLE JAMMEL,MONASTIR
395970,CITE UNIVERSITAIRE LES JASMINS DE SFAX ROUTE AEROPORT KM5,EDUCATION NATIONALE,ADMINISTRATION,MIN.ENS.SUP.RECH.SC.,CITE UNIVERSITAIRE LES JASMINS DE SFAX,SFAX
395980,ALI ZAABOUTI ECHABIBA GAFSA NORD,DEPOSITAIRES,DEPOSITAIRES,DEPOSITAIRES,ALI ZAABOUTI,GAFSA
396010,FRANCE TUNISIE INVESTISSEMENT HOTEL AL KANTARA- THALASSA ZONE TOURISTIQUE AGHIR- MIDOUNE- DJERBA,HOTELS-RESTAURANTS,HOTELS-RESTAURANTS,HOTELS-RESTAURANTS,HOTEL AL KANTARA- THALASSA,MEDENINE
396020,CITE UNIVERSITAIRE OKBA RAKADA - KAIROUAN,EDUCATION NATIONALE,ADMINISTRATION,MIN.ENS.SUP.RECH.SC.,CITE UNIVERSITAIRE OKBA RAKADA,KAIROUAN
396080,"MOKHTAR BEN NACEUR AVENUE,DE L'INDEPENDANCE CHORBANE",DEPOSITAIRES,DEPOSITAIRES,DEPOSITAIRES,MOKHTAR BEN NACEUR,MAHDIA
396090,"MOKHTAR BEN NACEUR AVENUE,DE L'INDEPENDANCE CHORBANE",DEPOSITAIRES,DEPOSITAIRES,DEPOSITAIRES,MOKHTAR BEN NACEUR,MAHDIA
396100,MOHAMED BEN JILANI BELAID CITE OUVRIERE ZARZOUNA BIZERTE,DEPOSITAIRES,DEPOSITAIRES,DEPOSITAIRES,MOHAMED BEN JILANI BELAID,BIZERTE
396110,LYCEE AHD JEDID CITE HEDI BEN HASSINE JENDOUBA,COLLEGE-LYCEE-ECOLE,ADMINISTRATION,MIN.EDUC.,LYCEE AHD JEDID CITE HEDI BEN HASSINE,JENDOUBA
396130,RESIDENCE MEHARI BEACH 25 AV. JEAN JAURES IMM. STB 9 ETAGE,HOTELS-RESTAURANTS,HOTELS-RESTAURANTS,HOTELS-RESTAURANTS,HOTEL RESIDENCE MEHARI BEACH,TUNIS
396150,HASSEN BEN MONGI SEDIRI AV. HABIB BOURGUIBA GHARDIMAOU JENDOUBA,DEPOSITAIRES,DEPOSITAIRES,DEPOSITAIRES,HASSEN BEN MONGI SEDIRI,JENDOUBA
396160,CENTRE DE FORMATION PROFESSIONNELLE AGRICOLE BEN AROUS CENTRE DE FORMATION PROFESSIONNELLE AGRICOLE BEN AROUS,EDUCATION NATIONALE,ADMINISTRATION,MIN. DE LA F.P ET DE L'EMPLOI,CENTRE DE FORMATION PROFESSIONNELLE AGRICOLE BEN AROUS,BEN AROUS
396170,MINISTERE DE LA DEFENSE BASE NAVALE LA GOULETTE MINISTERE DE LA DEFENSE BASE NAVALE LA GOULETTE,ARMEE GAZ,ADMINISTRATION,MIN.DEF.NAT.,BASE NAVALE LA GOULETTE,TUNIS
396190,SOTRAMA S/S AGIL BEN GUERDANE MEDENINE,DEPOSITAIRES,DEPOSITAIRES,DEPOSITAIRES,SOTRAMA,MEDENINE
396210,ODYSSEE HOTELS ROUTE TOURISTIQUE ZARZIS,HOTELS-RESTAURANTS,HOTELS-RESTAURANTS,HOTELS-RESTAURANTS,HOTELS ODYSSEE,MEDENINE
396230,SOCIETE HAMOUDA LAHBIB RUE KHEREDDINE EL ALIA BIZERTE,DEPOSITAIRES,DEPOSITAIRES,DEPOSITAIRES,HAMOUDA LAHBIB,BIZERTE
396240,SOCIETE HAMOUDA LAHBIB RUE KHEREDDINE EL ALIA BIZERTE,DEPOSITAIRES,DEPOSITAIRES,DEPOSITAIRES,HAMOUDA LAHBIB,BIZERTE
396280,"SOCIETE OXYGENE 10,RUE DE L'INDEPENDANCE MENZEL BOURGUIBA",DEPOSITAIRES,DEPOSITAIRES,DEPOSITAIRES,SOCIETE OXYGENE,BIZERTE
396300,PRISON DES FEMMES MANNOUBA PRISON DES FEMMES AV . 2 MARS 1934 MANNOUBA,ADMINISTRATION GAZ,ADMINISTRATION,MIN.DEF.NAT.,PRISON DES FEMMES MANNOUBA,TUNIS
396310,SOCIETE TECHNOLATEX ZONE INDUSTRIELLE DE BEJA,INDUSTRIEL GAZ,INDUSTRIEL GAZ,INDUSTRIEL GAZ,SOCIETE TECHNOLATEX,BEJA
396320,SOCIETE EL AMEL RUE NABHANA TEBOULBA ,DEPOSITAIRES,DEPOSITAIRES,DEPOSITAIRES,SOCIETE EL AMEL - MONASTIR,MONASTIR
396330,SOCIETE EL AMEL RUE NABHANA TEBOULBA MONASTIR,DEPOSITAIRES,DEPOSITAIRES,DEPOSITAIRES,SOCIETE EL AMEL - MONASTIR,MONASTIR
396340,SOCIETE EL AMEL RUE NABHANA TEBOULBA MONASTIR,DEPOSITAIRES,DEPOSITAIRES,DEPOSITAIRES,SOCIETE EL AMEL - MONASTIR,MONASTIR
396350,LYCEE SECONDAIRE ESSOMBAT EL HAMMA,COLLEGE-LYCEE-ECOLE,ADMINISTRATION,MIN.EDUC.,LYCEE SECONDAIRE ESSOMBAT EL HAMMA,GABES
396380,RESTAURANT UNIVERSITAIRE SILIANA,EDUCATION NATIONALE,ADMINISTRATION,MIN.ENS.SUP.RECH.SC.,RESTAURANT UNIVERSITAIRE SILIANA,SILIANA
396390,SOCIETE EL AMEL RUE NABHANA TEBOULBA ,DEPOSITAIRES,DEPOSITAIRES,DEPOSITAIRES,SOCIETE EL AMEL - MONASTIR,MONASTIR
396400,SOCIETE NATILAIT SOCIETE NATILAIT ROUTE DES RUINES UTIQUE BIZERTE,INDUSTRIEL GAZ,INDUSTRIEL GAZ,INDUSTRIEL GAZ,SOCIETE NATILAIT,BIZERTE
396410,SOCIETE AYA DISTRIBUTION K. 18 CEBELET BEN AMMAR SIDI THABET ARIANA,DEPOSITAIRES,DEPOSITAIRES,DEPOSITAIRES,SOCIETE AYA DISTRIBUTION K.,ARIANA
396430,COMMISSERIAT REGIONALE AFFAIRES FEMME . FAMILLE COMMISSERIAT REGIONALE AFFAIRES FEMMES . FAMILLE LE KEF,ADMINISTRATION GAZ,ADMINISTRATION,MIN. DE LA FEMME ET LA FAMILLE,COMMISSERIAT REGIONALE AFFAIRES FEMME,LE KEF
396440,SOCIETE AYA DISTRIBUTION K. 18 CEBELET BEN AMMAR SIDI THABET ARIANA,DEPOSITAIRES,DEPOSITAIRES,DEPOSITAIRES,SOCIETE AYA DISTRIBUTION K.,ARIANA
396460,SOCIETE EL WIFAK DE DISTRIBUTION ZONE INDUSTRILLE ENFIDHA SOUSSE,DEPOSITAIRES,DEPOSITAIRES,DEPOSITAIRES,SOCIETE EL WIFAK DE DISTRIBUTION,SOUSSE
396470,ETS BEN ABDALLAH ET FILS AVENUE 2 MARS 1934 MAHDIA,DEPOSITAIRES,DEPOSITAIRES,DEPOSITAIRES,ETS BEN ABDALLAH ET FILS,MAHDIA
396500,MONGI SEDIRI CITE EZZOUHOUR GHARDIMAOU JENDOUBA,DEPOSITAIRES,DEPOSITAIRES,DEPOSITAIRES,MONGI SEDIRI,JENDOUBA
396510,ANIS KACEM STATION SERVICE AGIL CARBURATION AUTO FOUCHANA,GPL C,GPL C,GPL C,FOUCHANA,BEN AROUS
396520,MOHSEN HAMDI ZONE INDUSTRIEL ROUTE AMDOUN BEJA,DEPOSITAIRES,DEPOSITAIRES,DEPOSITAIRES,MOHSEN HAMDI,BEJA
396530,ORDINAIRE DU 71 REGIMENT DES TRANSMISSIONS OUED ELLIL,ARMEE GAZ,ADMINISTRATION,MIN.DEF.NAT.,ORDINAIRE DU 71 REGIMENT DES TRANSMISSIONS OUED ELLIL,ARIANA
396540,ECOLE NATIONALE DES PRISONS ET DE REEDUCATION BORJ TOUIL,ADMINISTRATION GAZ,ADMINISTRATION,MIN.JUSTICE DROITS HOMME,ECOLE NATIONALE DES PRISONS ET DE REEDUCATION BORJ TOUIL,ARIANA
396560,EL AIDI BEN SEBTI MABROUK SENED GARE Z.4 SENED GAFSA,DEPOSITAIRES,DEPOSITAIRES,DEPOSITAIRES,EL AIDI BEN SEBTI MABROUK,GAFSA
396570,SOCIETE DOUKHALI DE COMMERCE 17. RUE DE MARSEILLE TUNIS,DEPOSITAIRES,DEPOSITAIRES,DEPOSITAIRES,SOCIETE DOUKHALI DE COMMERCE,TUNIS
396580,RESTAURANT UNIVERSITAIRE DE SIDI BOUZID RESTAURANT UNIVERSITAIRE DE SIDI BOUZID ROUTE DE GAFSA,EDUCATION NATIONALE,ADMINISTRATION,MIN.ENS.SUP.RECH.SC.,RESTAURANT UNIVERSITAIRE DE SIDI BOUZID,SIDI BOUZID
396590,SOCIETE LAGOON HOTEL MINOTEL DJERBA RESORT ZONE TOURISTIQUE AGHIR DJERBA,HOTELS-RESTAURANTS,HOTELS-RESTAURANTS,HOTELS-RESTAURANTS,HOTEL MINOTEL,MEDENINE
396600,ISET SILIANA,EDUCATION NATIONALE,ADMINISTRATION,MIN.ENS.SUP.RECH.SC.,ISET SILIANA,SILIANA
396610,SOCIETE DOUKHALI DE COMMERCE 17. RUE DE MARSEILLE TUNIS,DEPOSITAIRES,DEPOSITAIRES,DEPOSITAIRES,SOCIETE DOUKHALI DE COMMERCE,TUNIS
396620,SODIGAZ Z. INDUSTRIELLE EL BATEN KM.3 ,DEPOSITAIRES,DEPOSITAIRES,DEPOSITAIRES,SODIGAZ,KAIROUAN
396680,ALDIANA HOTEL RESORT A.H.R.C ZONE TOURISTIQUE MIDOUNE - DJERBA,HOTELS-RESTAURANTS,HOTELS-RESTAURANTS,HOTELS-RESTAURANTS,HOTEL ALDIANA RESORT A.H.R.C,MEDENINE
396650,SODIGAZ Z. INDUSTRIELLE EL BATEN ,DEPOSITAIRES,DEPOSITAIRES,DEPOSITAIRES,SODIGAZ,KAIROUAN
396690,SODIGAZ Z.INDUSTRIELLE EL BATEN KM.3 KAIROUAN,DEPOSITAIRES,DEPOSITAIRES,DEPOSITAIRES,SODIGAZ,KAIROUAN
396710,LYCEE 2 MARS 1934 LE KEF,COLLEGE-LYCEE-ECOLE,ADMINISTRATION,MIN.EDUC.,LYCEE 2 MARS 1934 LE KEF,LE KEF
396720,HASSEN BEN HAFSIA DOUKALI MORNAG,DIVERS GAZ,DIVERS GAZ,DIVERS GAZ,HASSEN BEN HAFSIA DOUKALI,BEN AROUS
396740,SOCIETE EL AMEL ROUTE DE L'AEROPORT ,DEPOSITAIRES,DEPOSITAIRES,DEPOSITAIRES,SOCIETE EL AMEL - TOZEUR,TOZEUR
396750,SOCIETE EL RAHMA SARL 01. AVENUE HABIB BOURGUIBA KALAAT ANDALOUS ARIANA,DEPOSITAIRES,DEPOSITAIRES,DEPOSITAIRES,SOCIETE EL RAHMA SARL,ARIANA
396760,SOCIETE EL RAHMA SARL 01. AVENUE HABIB BOURGUIBA KALAAT LANDALOUS ARIANA,DEPOSITAIRES,DEPOSITAIRES,DEPOSITAIRES,SOCIETE EL RAHMA SARL,ARIANA
396770,SOCIETE DE CIMENTS D'ENFIDHA SOCIETE DE CIMENTS D'ENFIDHA RTE DE ZAGHOUAN KM.10 ENFIDHA,INDUSTRIEL GAZ,INDUSTRIEL GAZ,INDUSTRIEL GAZ,SOCIETE DE CIMENTS D'ENFIDHA,SOUSSE
396790,HOPITAL REGIONAL ZARZIS ROUTE DE DJERBA ZARZIS,SANTE PUBLIQUE,ADMINISTRATION,MIN.SANTE PUB.,HOPITAL REGIONAL ZARZIS,MEDENINE
396830,STE NOUR PR DISTRIBUTION BOUTEILLES DE GAZ AV. HABIB BOURGUIBA EL KHRAISSIA GOUBELLAT BEJA,DEPOSITAIRES,DEPOSITAIRES,DEPOSITAIRES,STE NOUR,BEJA
396840,ECOLE PREPARATOIRE IBN ABI DHIEF HAJEB LAAYOUN KAIROUAN HAJEB LAYOUN,COLLEGE-LYCEE-ECOLE,ADMINISTRATION,MIN.EDUC.,ECOLE PREPARATOIRE IBN ABI DHIEF HAJEB LAAYOUN,KAIROUAN
396891,STATION SERVICE AGIL CARBURATION AUTO TAOUFIK JERBI S/S CARBURATION AUTO SALTNIA KM3 SFAX,GPL C,GPL C,GPL C,POUDRIERE 2 GPL,SFAX
396910,STE NOUR PR DISTRIBUTION BOUTEILLES DE GAZ AV. HABIB BOURGUIBA EL KHRAISSIA GOUBELLAT BEJA,DEPOSITAIRES,DEPOSITAIRES,DEPOSITAIRES,STE NOUR,BEJA
396940,SOCIETE FILS MOHAMED BEN AMMAR DE COMMERCE AV. DE LA LIBERTE BIR ALI BEN KHALIFA SFAX,DEPOSITAIRES,DEPOSITAIRES,DEPOSITAIRES,SOCIETE FILS MOHAMED BEN AMMAR DE COMMERCE,SFAX
397000,COMPLEXE SANITAIRE DJEBEL EL OUEST,SANTE PUBLIQUE,ADMINISTRATION,MIN.SANTE PUB.,COMPLEXE SANITAIRE DJEBEL EL OUEST,ZAGHOUAN
397050,MESS DES SOUS OFFICIERS BAB SAADOUNE,ARMEE GAZ,ADMINISTRATION,MIN.DEF.NAT.,MESS DES SOUS OFFICIERS BAB SAADOUNE,TUNIS
397100,SOCIETE COMMERCIALE EL HILAL RUE ABOU KACEM CHEBBI AIN DRAHAM,DEPOSITAIRES,DEPOSITAIRES,DEPOSITAIRES,SOCIETE COMMERCIALE EL HILAL ,JENDOUBA
397120,AMEN SERVICE GAZ KM1 ROUTE AEROPORT SFAX,DEPOSITAIRES,DEPOSITAIRES,DEPOSITAIRES,SOCIETE AMEN SERVICE GAZ,SFAX
397160,INTERNAT PRIMAIRE EL M'NAGAA ROUTE AIN ASKAR EL FAHS,COLLEGE-LYCEE-ECOLE,ADMINISTRATION,MIN.EDUC.,INTERNAT PRIMAIRE EL M'NAGAA,ZAGHOUAN
397180,RESTAURANT UNIVERSITAIRE IBN RACHED GAFSA,EDUCATION NATIONALE,ADMINISTRATION,MIN.ENS.SUP.RECH.SC.,RESTAURANT UNIVERSITAIRE IBN RACHED GAFSA,GAFSA
397260,HOTEL KSAR JERID BP 201 TOZEUR,HOTELS-RESTAURANTS,HOTELS-RESTAURANTS,HOTELS-RESTAURANTS,HOTEL KSAR JERID,TOZEUR
397350,RESTAURANT UNIVERSITAIRE DE LA TECHNOPOLE DE SIDI THABET RESTAURANT UNIVERSITAIRE DE LA TECHNOPOLE SIDI THABET,EDUCATION NATIONALE,ADMINISTRATION,MIN.ENS.SUP.RECH.SC.,RESTAURANT UNIVERSITAIRE DE LA TECHNOPOLE DE SIDI THABET,ARIANA
397360,TAHAR BADIS 2. RUE EL MANJOUR TUNIS,DEPOSITAIRES,DEPOSITAIRES,DEPOSITAIRES,TAHAR BADIS,TUNIS
397380,CENTRE INTEGRE DE LA JEUNESSE ET DE L'ENFANCE SIDI THABET,COLLEGE-LYCEE-ECOLE,ADMINISTRATION,MIN.EDUC.,CENTRE INTEGRE DE LA JEUNESSE ET DE L'ENFANCE SIDI THABET,ARIANA
397480,RESTAURANT UNIVERSITAIRE ALI BELHOUENE JENDOUBA,EDUCATION NATIONALE,ADMINISTRATION,MIN.ENS.SUP.RECH.SC.,RESTAURANT UNIVERSITAIRE ALI BELHOUENE,JENDOUBA
397530,FOYER UNIVERSITAIRE MAHMOUD EL MESSAADI JENDOUBA,EDUCATION NATIONALE,ADMINISTRATION,MIN.ENS.SUP.RECH.SC.,FOYER UNIVERSITAIRE MAHMOUD EL MESSAADI,JENDOUBA
397540,SOCIETE LABORATOIRE TUNISIE PHARMA 02. RUE DE L'ENERGIE CHARGUIA 1 . TUNIS,INDUSTRIEL GAZ,INDUSTRIEL GAZ,INDUSTRIEL GAZ,SOCIETE LABORATOIRE TUNISIE PHARMA,TUNIS
397580,SALEM BEN SALAH BAREG EL AJENGUA JEBENIANA SFAX,DEPOSITAIRES,DEPOSITAIRES,DEPOSITAIRES,SALEM BEN SALAH BAREG EL AJENGUA,SFAX
397720,SOCIETE AGIL DE GESTION SAGES AV. MOHAMED ALI AKID CITE OLYMPIQUE EL KHADRA TUNIS,GPL C,GPL C,GPL C,S. KHELIFA pk72 ,SOUSSE
397730,SOCIETE MEDDEB DES PRODUCTIONS ALIMENTAIRES (SMPA) STE MEDDEB DES PRODUCTIONS ALIMENTAIRES RUE HABIB HADDAD BEJA,INDUSTRIEL GAZ,INDUSTRIEL GAZ,INDUSTRIEL GAZ,SOCIETE MEDDEB DES PRODUCTIONS ALIMENTAIRES (SMPA),BEJA
397740,SALEM BEN SALAH BAREG EL AJENGUA JBENIANA SFAX,DEPOSITAIRES,DEPOSITAIRES,DEPOSITAIRES,SALEM BEN SALAH BAREG EL AJENGUA,SFAX
397760,SOCIETE BOURGO CENTER IMMOBILIERE (S.B.C.I ) STE BOURGO CENTER IMMOBILIERE RTE HOUMT SOUK JERBA MIDOUN,HOTELS-RESTAURANTS,HOTELS-RESTAURANTS,HOTELS-RESTAURANTS,SOCIETE BOURGO CENTER IMMOBILIERE (S.B.C.I ),MEDENINE
397790,NABIL BEN AHMED ZIDI ROUTE DE TUNIS Z 3 JENDOUBA,DEPOSITAIRES,DEPOSITAIRES,DEPOSITAIRES,NABIL BEN AHMED ZIDI,JENDOUBA
