Compte ,Client ,Secteurs Statistique,Catégorie,Secteurs clients,Consolidation Client,Gouvernorat
382281,HOTEL CEDRIANE JERBA,HOTELS-RESTAURANTS,HOTELS-RESTAURANTS,HOTELS-RESTAURANTS,HOTEL CEDRIANE JERBA,MEDENINE
382291,SOCIETE GOING SRL HOTEL ILIADE JERBA,HOTELS-RESTAURANTS,HOTELS-RESTAURANTS,HOTELS-RESTAURANTS,HOTEL ILIADE JERBA,MEDENINE
382301,HOTEL DJERBA HAROUN B.P 96 SIDI MEHREZ DJERBA,HOTELS-RESTAURANTS,HOTELS-RESTAURANTS,HOTELS-RESTAURANTS,HOTEL DJERBA HAROUN DJERBA,MEDENINE
382311,SOCIETE VISION TOURISME HOTEL KSAR DJERBA JERBA,HOTELS-RESTAURANTS,HOTELS-RESTAURANTS,HOTELS-RESTAURANTS,HOTEL KSAR DJERBA,MEDENINE
382321,SANES STE D'ETUDE ET D'EXPLOITATION TOURISTIQUE HOTEL NEREIDES ZONE TOURISTIQUE MIDOUN -DJERBA,HOTELS-RESTAURANTS,HOTELS-RESTAURANTS,HOTELS-RESTAURANTS,HOTEL NEREIDES DJERBA,MEDENINE
382341,SOCIETE MEDITERRANEO HOTEL EDEN VILLAGE DJERBA MARE HOTEL EDEN VILLAGE JERBA MARE_MIDOUN B.P249,HOTELS-RESTAURANTS,HOTELS-RESTAURANTS,HOTELS-RESTAURANTS,HOTEL EDEN VILLAGE DJERBA,MEDENINE
382351,GROUPE POULINA Z.I ROUTE DE KHNISS KM 2.5 MONASTIR B.P 207,INDUSTRIEL GAZ,INDUSTRIEL GAZ,INDUSTRIEL GAZ,GROUPE POULINA,MONASTIR
382351,GROUPE POULINA MBG GP1 KM 12 EZZAHRA,INDUSTRIEL GAZ,INDUSTRIEL GAZ,INDUSTRIEL GAZ,GROUPE POULINA,MONASTIR
382381,CLUB DIANA RIMEL ZONE TOURISTIQUE ENNADHOUR MIDOUN DJERBA,HOTELS-RESTAURANTS,HOTELS-RESTAURANTS,HOTELS-RESTAURANTS,HOTEL CLUB DIANA RIMEL,MEDENINE
382391,TUNISACIER S-A PARC D'CTIVITES ECONOM BAIE DE SABRA BIZERTE,INDUSTRIEL GAZ,INDUSTRIEL GAZ,INDUSTRIEL GAZ,TUNISACIER S-A,BIZERTE
382401,SANDRAP (PROMOTEX) ZONE INDUSTRIELLE BEN AROUS,INDUSTRIEL GAZ,INDUSTRIEL GAZ,INDUSTRIEL GAZ,SANDRAP (PROMOTEX),BEN AROUS
382411,"MED FOOD S.A AV,7 NOVEMBRE N 49 MENZEL JEMIL",HOTELS-RESTAURANTS,HOTELS-RESTAURANTS,HOTELS-RESTAURANTS,MED FOOD S.A,BIZERTE
382420,FERID AKROUT CEBELET MORNAG,DIVERS GAZ,DIVERS GAZ,DIVERS GAZ,FERID AKROUT,BEN AROUS
382431,ECOLE SUPERIEURE D'AGRICULTURE,ADMINISTRATION GAZ,ADMINISTRATION,MIN.AGRIC.ENV.RESS.HYD.,ECOLE SUPERIEURE D'AGRICULTURE,ZAGHOUAN
382491,LYCEE SECONDAIRE SLIMANE BEN SLIMANE ZAGHOUAN AV DE L'INDEPENDANCE ZAGHOUAN,EDUCATION NATIONALE,ADMINISTRATION,MIN.EDUC.,LYCEE SECONDAIRE SLIMANE,ZAGHOUAN
382501,ECOLE PREPARATOIRE DE SIDI AOUIDETTE SIDI AOUIDETTE ROUTE DE SILIANA,COLLEGE-LYCEE-ECOLE,ADMINISTRATION,MIN.EDUC.,ECOLE PREPARATOIRE DE SIDI AOUIDETTE,ZAGHOUAN
382531,ALI BEN AMMAR BEN BOUKHIT SKHIRA,DEPOSITAIRES,DEPOSITAIRES,DEPOSITAIRES,ALI BEN AMMAR BEN BOUKHIT,SFAX
382570,W MAGIC SARL ZONE FRANCHE DE BIZERTE TUNISIE,INDUSTRIEL GAZ,INDUSTRIEL GAZ,INDUSTRIEL GAZ,W MAGIC SARL,BIZERTE
382600,CENTRE DE MECANIQUE DE RECYCLAGE DE VULGARISATION AGRICOLE BARROUTA KAIROUAN,ADMINISTRATION GAZ,ADMINISTRATION,MIN.AGRIC.ENV.RESS.HYD.,CENTRE DE MECANIQUE DE RECYCLAGE DE VULGARISATION AGRICOLE,KAIROUAN
382620,CITE UNIVERSITAIRE SICCAVENIRIA LE KEF,COLLEGE-LYCEE-ECOLE,ADMINISTRATION,MIN.ENS.SUP.RECH.SC.,CITE UNIVERSITAIRE SICCAVENIRIA,LE KEF
382651,LYCEE HABIB BOURGUIBA DAHMANI,COLLEGE-LYCEE-ECOLE,ADMINISTRATION,MIN.EDUC.,LYCEE HABIB BOURGUIBA DAHMANI,LE KEF
382681,INSTITUT SUPERIEUR DU SPORT ET DE L'EDUCATION PHYSIQUE LE KEF LE KEF,COLLEGE-LYCEE-ECOLE,ADMINISTRATION,MIN.ENS.SUP.RECH.SC.,INSTITUT SUPERIEUR DU SPORT ET DE L'EDUCATION PHYSIQUE,LE KEF
382721,BASE AERIENNE KHARROUBA BIZERTE,ARMEE GAZ,ADMINISTRATION,MIN.DEF.NAT.,BASE AERIENNE KHARROUBA,BIZERTE
382731,ECOLE PREPARATOIRE CHBIKA CHBIKA,COLLEGE-LYCEE-ECOLE,ADMINISTRATION,MIN.EDUC.,ECOLE PREPARATOIRE CHBIKA,TOZEUR
382741,LYCEE DE SBIKHA SBIKHA,EDUCATION NATIONALE,ADMINISTRATION,MIN.EDUC.,LYCEE DE SBIKHA,KAIROUAN
382821,ECOLE NORMALE SUPERIEURE D'EDUCATION PHYSIQUE KSAR SAID,COLLEGE-LYCEE-ECOLE,ADMINISTRATION,MIN.EDUC.,ECOLE NORMALE SUPERIEURE D'EDUCATION PHYSIQUE KSAR SAID,MANOUBA
382831,LYCEE SECONDAIRE EL KSOUR,COLLEGE-LYCEE-ECOLE,ADMINISTRATION,MIN.EDUC.,LYCEE SECONDAIRE EL KSOUR,LE KEF
382841,CENTRE REGIONAL DE L'EDUCATION ET DE LA FORMA TION CONTINUE KEF,COLLEGE-LYCEE-ECOLE,ADMINISTRATION,MIN.EDUC.,CENTRE REGIONAL DE L'EDUCATION ET DE LA FORMA TION CONTINUE KEF,LE KEF
382861,ECOLE SUPERIEURE D'AGRICULTURE MATEUR,COLLEGE-LYCEE-ECOLE,ADMINISTRATION,MIN.EDUC.,ECOLE SUPERIEURE D'AGRICULTURE MATEUR,BIZERTE
382891,LYCEE SECONDAIRE IBN ABI DHIAF TEBOURSOUK,EDUCATION NATIONALE,ADMINISTRATION,MIN.EDUC.,LYCEE SECONDAIRE IBN ABI DHIAF TEBOURSOUK,BEJA
382901,ECOLE SUPERIEUR DES INGENIEURS D'EQUIPEMENT RURAL M.ELBAB,EDUCATION NATIONALE,ADMINISTRATION,MIN.ENS.SUP.RECH.SC.,ECOLE SUPERIEUR DES INGENIEURS D'EQUIPEMENT RURAL M.ELBAB,BEJA
382921,ECOLE HOTELIERE AIN DRAHEM,EDUCATION NATIONALE,ADMINISTRATION,MIN.ENS.SUP.RECH.SC.,ECOLE HOTELIERE AIN DRAHEM,JENDOUBA
382961,ECOLE PREPARATOIRE DE BOU-SALEM BOUSALEM,COLLEGE-LYCEE-ECOLE,ADMINISTRATION,MIN.EDUC.,ECOLE PREPARATOIRE DE BOU-SALEM BOUSALEM,JENDOUBA
383011,PRISON CIVILE LE KEF,ADMINISTRATION GAZ,ADMINISTRATION,MIN.JUSTICE DROITS HOMME,PRISON CIVILE LE KEF,LE KEF
383041,CENTRE INTEGREE DE LA JENESSE ET DE L'ENFANCE SFAX,COLLEGE-LYCEE-ECOLE,ADMINISTRATION,MIN.EDUC.,CENTRE INTEGREE DE LA JENESSE ET DE L'ENFANCE SFAX,SFAX
383051,CENTRE REGIONAL DE L'EDUCATION ET DE LA FORMATION CONTINUE SFAX,COLLEGE-LYCEE-ECOLE,ADMINISTRATION,MIN.EDUC.,CENTRE REGIONAL DE L'EDUCATION ET DE LA FORMATION CONTINUE SFAX,SFAX
383101,CENTRE INTEGRE DE LA JEUNESSE ET DE L'ENFANCE SAKIET SIDI YOUSSEF,COLLEGE-LYCEE-ECOLE,ADMINISTRATION,MIN.EDUC.,CENTRE INTEGRE DE LA JEUNESSE ET DE L'ENFANCE SAKIET SIDI YOUSSEF,LE KEF
383121,CENTRE INTEGRE DE LA JEUNESSE ET DE L'ENFANCE LE KEF,COLLEGE-LYCEE-ECOLE,ADMINISTRATION,MIN.EDUC.,CENTRE INTEGRE DE LA JEUNESSE ET DE L'ENFANCE LE KEF,LE KEF
383151,LYCEE SECONDAIRE MAKNASSY,EDUCATION NATIONALE,ADMINISTRATION,MIN.EDUC.,LYCEE SECONDAIRE MAKNASSY,SIDI BOUZID
383191,LYCEE HBIRA HBIRA,EDUCATION NATIONALE,ADMINISTRATION,MIN.EDUC.,LYCEE HBIRA HBIRA,MAHDIA
383221,LYCEE PILOTE ROUTE DE GABES KM1 SFAX,COLLEGE-LYCEE-ECOLE,ADMINISTRATION,MIN.EDUC.,LYCEE PILOTE,SFAX
383231,ECOLE PREPARATOIRE SKHIRA,EDUCATION NATIONALE,ADMINISTRATION,MIN.EDUC.,MIN.EDUC.,SFAX
383241,ECOLE SUPERIEURE DES SCIENCES ET TECHNIQUES D E LA SANTE SFAX,COLLEGE-LYCEE-ECOLE,ADMINISTRATION,MIN.ENS.SUP.RECH.SC.,ECOLE SUPERIEURE DES SCIENCES ET TECHNIQUES D E LA SANTE SFAX,SFAX
383251,FOYER UNIVERSITAIRE RUE COMMANDANT BEJAOUI,COLLEGE-LYCEE-ECOLE,ADMINISTRATION,MIN.ENS.SUP.RECH.SC.,FOYER UNIVERSITAIRE RUE COMMANDANT BEJAOUI,SFAX
383261,FOYER UNIVERSITAIRE IMAM SAHNOUN SFAX,COLLEGE-LYCEE-ECOLE,ADMINISTRATION,MIN.ENS.SUP.RECH.SC.,FOYER UNIVERSITAIRE IMAM SAHNOUN SFAX,SFAX
384290,ECOLE PREPARATOIRE EL MIDA EL MIDA,COLLEGE-LYCEE-ECOLE,ADMINISTRATION,MIN.EDUC.,ECOLE PREPARATOIRE EL MIDA,NABEUL
383291,LYCEE SECONDAIRE M.CHAKER,COLLEGE-LYCEE-ECOLE,ADMINISTRATION,MIN.EDUC.,LYCEE SECONDAIRE M.CHAKER,SFAX
383331,COLLEGE SECONDAIRE EL GUETTAR,EDUCATION NATIONALE,ADMINISTRATION,MIN.EDUC.,COLLEGE SECONDAIRE EL GUETTAR,GAFSA
383371,LYCEE TECHNIQUE ABOULCACEM CHEBBI GABES,EDUCATION NATIONALE,ADMINISTRATION,MIN.EDUC.,LYCEE TECHNIQUE ABOULCACEM CHEBBI,GABES
383381,LYCEE MIXTE EL HAMMA,COLLEGE-LYCEE-ECOLE,ADMINISTRATION,MIN.EDUC.,LYCEE MIXTE EL HAMMA,GABES
383411,CENTRE DE FORMATION PROFFESSIONNELLE AGRICOLE EL ALIA,COLLEGE-LYCEE-ECOLE,ADMINISTRATION,MIN.AGRIC.ENV.RESS.HYD.,CENTRE DE FORMATION PROFFESSIONNELLE AGRICOLE EL ALIA,BIZERTE
383420,S O N E D E 23 RUE SIDI ZOUAOUI TUNIS,ADMINISTRATION GAZ,ADMINISTRATION,S O N E D E,S O N E D E,TUNIS
383441,CASERNE DE LA BRIGADE DE L'ORDRE PUBLIC AV MONCEF BEY TUNIS,ADMINISTRATION GAZ,ADMINISTRATION,MIN.INTER.DEV.LOC.,CASERNE DE LA BRIGADE DE L'ORDRE PUBLIC,TUNIS
383461,MINISTERE DE LA JUSTICE DIRECTION GLE DES PRISONS ET DE LA REEDUCATION TUNIS,ADMINISTRATION GAZ,ADMINISTRATION,MIN.JUSTICE DROITS HOMME,DIRECTION GLE DES PRISONS ET DE LA REEDUCATION,TUNIS
383471,COMITE REGIONALE DE SOLIDARITE SOCIALE BIZERTE,ADMINISTRATION GAZ,ADMINISTRATION,MIN.AFF.SOCIALES,COMITE REGIONALE DE SOLIDARITE SOCIALE BIZERTE,BIZERTE
383481,CENTRE INTEGRE DE LA JENNESSE ET DE L'ENFANCE BIZERTE,COLLEGE-LYCEE-ECOLE,ADMINISTRATION,MIN.EDUC.,CENTRE INTEGRE DE LA JENNESSE ET DE L'ENFANCE BIZERTE,BIZERTE
383491,CAISSE NATIONALE DE SECURITE SOCIALE BIZERTE,ADMINISTRATION GAZ,ADMINISTRATION,MIN.AFF.SOCIALES,CAISSE NATIONALE DE SECURITE SOCIALE BIZERTE,BIZERTE
383511,MIN. DE LA F.P ET DE L'EMPLOI A.T.F.P. C.S.F.C.M. MENZEL BOURGUIBA,COLLEGE-LYCEE-ECOLE,ADMINISTRATION,MIN. DE LA F.P ET DE L'EMPLOI,A.T.F.P. C.S.F.C.M. MENZEL BOURGUIBA,BIZERTE
383521,CENTRE DE FORMATION ET D'APPRENTISSAGE MATEUR ROUTE DE TABARKA KM1 MATEUR,COLLEGE-LYCEE-ECOLE,ADMINISTRATION,MIN. DE LA F.P ET DE L'EMPLOI,CENTRE DE FORMATION ET D'APPRENTISSAGE MATEUR,BIZERTE
383531,CASERNE SIDI YAHIA MENZEL BOURGUIBA,ARMEE GAZ,ADMINISTRATION,MIN.DEF.NAT.,CASERNE SIDI YAHIA MENZEL BOURGUIBA,BIZERTE
383541,SERICE ORDINAIRE REGIMENT D'HONNEUR LA MANOUBA,ARMEE GAZ,ADMINISTRATION,MIN.DEF.NAT.,SERICE ORDINAIRE REGIMENT D'HONNEUR LA MANOUBA,ARIANA
383551,CENTRE MILITAIRE CANIN ORDINAIRE DE TROUPE BIZERTE,ARMEE GAZ,ADMINISTRATION,MIN.DEF.NAT.,CENTRE MILITAIRE CANIN,BIZERTE
383571,DIRECTION DE L'USINE DE MUNITION ARIANA,ARMEE GAZ,ADMINISTRATION,MIN.DEF.NAT.,DIRECTION DE L'USINE DE MUNITION ARIANA,ARIANA
383581,51 REGIMENT DE FUSILLERS MARINS BASE NAVALE LA PECHERIE,ARMEE GAZ,ADMINISTRATION,MIN.DEF.NAT.,51 REGIMENT DE FUSILLERS MARINS BASE NAVALE LA PECHERIE,BIZERTE
383591,CERCLE MILITAIRE BIZERTE,ARMEE GAZ,ADMINISTRATION,MIN.DEF.NAT.,CERCLE MILITAIRE BIZERTE,BIZERTE
383601,ECOLE TECHNIQUE DE L' ARMEE DE TERRE ( E.T.A.T ) BIZERTE,ARMEE GAZ,ADMINISTRATION,MIN.DEF.NAT.,ECOLE TECHNIQUE DE L' ARMEE DE TERRE ( E.T.A.T ) BIZERTE,BIZERTE
383621,CASERNE TABARKA 16EME RIMECA - AIN DRAHAM,ARMEE GAZ,ADMINISTRATION,MIN.DEF.NAT.,CASERNE TABARKA 16EME RIMECA - AIN DRAHAM,JENDOUBA
383631,MINISTERE DE LA DEFENSE NATIONALE ACADEMIE NAVALE MENZEL BOURGUIBA ACADEMIE NAVALE MENZEL BOURGUIBA,ARMEE GAZ,ADMINISTRATION,MIN.DEF.NAT.,ACADEMIE NAVALE MENZEL BOURGUIBA,BIZERTE
383641,93.EME REGIMENT DE SOUTIEN EL BATEN B.P 27 3140 OKBA KAIROUAN,ARMEE GAZ,ADMINISTRATION,MIN.DEF.NAT.,93.EME REGIMENT DE SOUTIEN EL BATEN,KAIROUAN
383651,32 EME REGIMENT DE CHARS EL BATEN EL BATEN KAIROUAN,ARMEE GAZ,ADMINISTRATION,MIN.DEF.NAT.,32 EME REGIMENT DE CHARS EL BATEN,KAIROUAN
383661,CASERNE 41 REGIMENT D'ARTILLERIE 105 SBEITLA,ARMEE GAZ,ADMINISTRATION,MIN.DEF.NAT.,CASERNE 41 REGIMENT D'ARTILLERIE 105 SBEITLA,KASSERINE
383711,BASE NAVALE 15 JUILLET 1881 ROUTE SIDI MANSOUR SFAX,ARMEE GAZ,ADMINISTRATION,MIN.DEF.NAT.,BASE NAVALE 15 JUILLET 1881,SFAX
383721,CASERNE BASE AERIENNE GAFSA,ARMEE GAZ,ADMINISTRATION,MIN.DEF.NAT.,CASERNE BASE AERIENNE GAFSA,GAFSA
383731,CASERNE KEBILI KEBILI,ARMEE GAZ,ADMINISTRATION,MIN.DEF.NAT.,CASERNE KEBILI,KEBILI
383741,HOPITAL MILITAIRE REGIONAL GABES,SANTE PUBLIQUE,ADMINISTRATION,MIN.DEF.NAT.,HOPITAL MILITAIRE REGIONAL GABES,GABES
383771,"CASERNE 43 REGIMENT D""ARTILLERIE DE CAMPAGNE MEDNINE",ARMEE GAZ,ADMINISTRATION,MIN.DEF.NAT.,"CASERNE 43 REGIMENT D""ARTILLERIE DE CAMPAGNE MEDNINE",MEDENINE
383791,CASERNE ZARZIS ZARZIS,ARMEE GAZ,ADMINISTRATION,MIN.DEF.NAT.,CASERNE ZARZIS,MEDENINE
383801,CASERNE 33 R.R BEN GUERDANE,ARMEE GAZ,ADMINISTRATION,MIN.DEF.NAT.,CASERNE 33 R.R BEN GUERDANE,MEDENINE
383811,17 REGIMENT INFANTERIE MOTORISEE TATAOUINE,ARMEE GAZ,ADMINISTRATION,MIN.DEF.NAT.,17 REGIMENT INFANTERIE MOTORISEE TATAOUINE,TATAOUINE
383911,PRISON CIVILE LA RABTA LA RABTA TUNIS,ADMINISTRATION GAZ,ADMINISTRATION,MIN.JUSTICE DROITS HOMME,PRISON CIVILE LA RABTA,TUNIS
383981,COLLEGE SECONDAIRE BOUARGOUB,COLLEGE-LYCEE-ECOLE,ADMINISTRATION,MIN.EDUC.,COLLEGE SECONDAIRE BOUARGOUB,NABEUL
384030,"SOCIETE ETICOR 44,RUE ALI BEN GHEDAHEM - TUNIS",INDUSTRIEL GAZ,INDUSTRIEL GAZ,INDUSTRIEL GAZ,SOCIETE ETICOR,ARIANA
384190,ECOLE PREPARATOIRE DAHMANI,COLLEGE-LYCEE-ECOLE,ADMINISTRATION,MIN.EDUC.,ECOLE PREPARATOIRE DAHMANI,LE KEF
384290,ECOLE PREPARATOIRE EL MIDA EL MIDA,COLLEGE-LYCEE-ECOLE,ADMINISTRATION,MIN.EDUC.,ECOLE PREPARATOIRE EL MIDA,NABEUL
384490,FOYER UNIVERSITAIRE EL BASSATINE SFAX,EDUCATION NATIONALE,ADMINISTRATION,MIN.ENS.SUP.RECH.SC.,FOYER UNIVERSITAIRE EL BASSATINE SFAX,SFAX
384520,ECOLE PREPARATOIRE DE BALTA BALTA,COLLEGE-LYCEE-ECOLE,ADMINISTRATION,MIN.EDUC.,ECOLE PREPARATOIRE DE BALTA,JENDOUBA
384550,LYCEE SECONDAIRE NEBEUR NEBEUR,COLLEGE-LYCEE-ECOLE,ADMINISTRATION,MIN.EDUC.,LYCEE SECONDAIRE NEBEUR,LE KEF
384790,CENTRE SECTORIEL DE FOR PROFESS EN MECANIQUE NAVALE DE KELIBIA KELIBIA,EDUCATION NATIONALE,ADMINISTRATION,MIN. DE LA F.P ET DE L'EMPLOI,CENTRE SECTORIEL DE FOR PROFESS EN MECANIQUE NAVALE DE KELIBIA,NABEUL
385000,SOCIETE INTERNATIONALE TOURISTIQUE ET IMMOBILIERE (SITI) ZONE TOURISTIQUE MIDOUN B.P 360 DJERBA,HOTELS-RESTAURANTS,HOTELS-RESTAURANTS,HOTELS-RESTAURANTS,SOCIETE INTERNATIONALE TOURISTIQUE ET IMMOBILIERE (SITI),MEDENINE
385020,BUANDERIE DE DJERBA 7/9 RUE MOHAMED ALI ANNABI TUNIS BELVEDERE,INDUSTRIEL GAZ,INDUSTRIEL GAZ,INDUSTRIEL GAZ,BUANDERIE DE DJERBA,MEDENINE
385030,HOTEL EDEN STAR ROUTE TOURISTIQUE ZARZIS,HOTELS-RESTAURANTS,HOTELS-RESTAURANTS,HOTELS-RESTAURANTS,HOTEL EDEN BEACH,MEDENINE
385040,MOHAMED ALI BEN CHEIKH ROUTE CORNICHE BIZERTE,DEPOSITAIRES,DEPOSITAIRES,DEPOSITAIRES,MOHAMED ALI BEN CHEIKH,BIZERTE
385050,CENTRE REGIONAL DE L'EDUCATION ET DE LA FORMATION CONTINUE JENDOUBA,COLLEGE-LYCEE-ECOLE,ADMINISTRATION,MIN.EDUC.,CENTRE REGIONAL DE L'EDUCATION ET DE LA FORMATION CONTINUE JENDOUBA,JENDOUBA
385141,KAMEL EL OUNI S/S AGIL CARBURATION AUTO SAHLOUL SOUSSE SAHLOUL SOUSSE,GPL C,GPL C,GPL C,SAHLOUL,SOUSSE
385181,BRAHIM BEL MABROUK KEBILI,DEPOSITAIRES,DEPOSITAIRES,DEPOSITAIRES,BRAHIM BEL MABROUK,KEBILI
385240,HOTEL RAMLA TOZEUR,HOTELS-RESTAURANTS,HOTELS-RESTAURANTS,HOTELS-RESTAURANTS,HOTEL RAMLA TOZEUR,TOZEUR
385261,DALY FAYCEL S/S CARBURATION AUTO ROUTE DE TOZEUR GAFSA,GPL C,GPL C,GPL C,GAFSA Rte DE TOZ.,GAFSA
385270,FACULTE DES LETTRES ET SIENCES HUMAINES RTE DE L'AEROPORT SFAX,EDUCATION NATIONALE,ADMINISTRATION,MIN.ENS.SUP.RECH.SC.,FACULTE DES LETTRES ET SIENCES HUMAINES,SFAX
385350,HOTEL LATINO ZONE TOURISTIQUE MIDOUN DJERBA,HOTELS-RESTAURANTS,HOTELS-RESTAURANTS,HOTELS-RESTAURANTS,HOTEL LATINO,MEDENINE
385440,HOTEL MARHALA B.P 41 NAFTA,HOTELS-RESTAURANTS,HOTELS-RESTAURANTS,HOTELS-RESTAURANTS,HOTEL MARHALA,TOZEUR
385460,LES LABORATOIRES REUNIS ROUTE KORBOUS KM5 BP:58 SOLIMAN,INDUSTRIEL GAZ,INDUSTRIEL GAZ,INDUSTRIEL GAZ,LES LABORATOIRES REUNIS,NABEUL
385480,SOCIETE DE PROMOTION TOURISTIQUE HOTEL JERBA CASTILLE ZONE TOURISTIQUE AGHIR - DJERBA,HOTELS-RESTAURANTS,HOTELS-RESTAURANTS,HOTELS-RESTAURANTS,HOTEL JERBA CASTILLE,MEDENINE
385491,"SOCIETE TUNISIENNE DE VETEMENT DE TRAVAIL LOISIR (V.T.L) 3,RUE DU LAC TOBA,1053 LES BERGES DU LAC",INDUSTRIEL GAZ,INDUSTRIEL GAZ,INDUSTRIEL GAZ,SOCIETE TUNISIENNE DE VETEMENT DE TRAVAIL LOISIR (V.T.L),NABEUL
385501,FOYER UNIVERSITAIRE IBN MANDHOUR ROUTE DE TOZEUR GAFSA,EDUCATION NATIONALE,ADMINISTRATION,MIN.ENS.SUP.RECH.SC.,FOYER UNIVERSITAIRE IBN MANDHOUR,GAFSA
385590,HOPITAL REGIONAL DE BEN GUERDANE BEN GUERDANE,SANTE PUBLIQUE,ADMINISTRATION,MIN.SANTE PUB.,HOPITAL REGIONAL DE BEN GUERDANE,MEDENINE
385800,HOTEL JASMINA PARK THALLASSA HOUMT SOUK B.P217 DJERBA,HOTELS-RESTAURANTS,HOTELS-RESTAURANTS,HOTELS-RESTAURANTS,HOTEL JASMINA PARK THALLASSA,MEDENINE
385920,ECOLE PREPARATOIRE FARHAT HACHED SIDI NEJI ZAGHOUAN,COLLEGE-LYCEE-ECOLE,ADMINISTRATION,MIN.EDUC.,ECOLE PREPARATOIRE FARHAT HACHED SIDI NEJI,ZAGHOUAN
385990,STEG 38 RUE KAMEL ATTATURK,INDUSTRIEL GAZ,INDUSTRIEL GAZ,INDUSTRIEL GAZ,STEG,TUNIS
386040,MINISTERE DE L'INTERIEUR SCE DE L'ENTRETIEN DES BATIMENTS TUNIS,ADMINISTRATION GAZ,ADMINISTRATION,MIN.INTER.DEV.LOC.,SCE DE L'ENTRETIEN DES BATIMENTS,TUNIS
386050,COLLEGE SECONDAIRE KHIAREDDINE EL FAHS,EDUCATION NATIONALE,ADMINISTRATION,MIN.EDUC.,COLLEGE SECONDAIRE KHIAREDDINE EL FAHS,ZAGHOUAN
386070,HOTEL TOUAREG DOUZ,HOTELS-RESTAURANTS,HOTELS-RESTAURANTS,HOTELS-RESTAURANTS,HOTEL TOUAREG DOUZ,KEBILI
386080,DIRECTION DU MATERIEL ROULANT ET DES ESSENCES (CUISINE) FONDOUK JEDID,ARMEE GAZ,ADMINISTRATION,MIN.DEF.NAT.,DIRECTION DU MATERIEL ROULANT ET DES ESSENCES (CUISINE) FONDOUK JEDID,NABEUL
386110,SOCIETE MEDITERRANEO HOTEL MEHARI TABARKA ZONE TOURISTIQUE TABARKA,HOTELS-RESTAURANTS,HOTELS-RESTAURANTS,HOTELS-RESTAURANTS,HOTELS MEHARI,JENDOUBA
386120,LYCEE EL AHD EL JADID THIBAR,EDUCATION NATIONALE,ADMINISTRATION,MIN.EDUC.,LYCEE EL AHD EL JADID THIBAR,BEJA
386130,LIYCEE SECTORIEL DE LA FOMATION PROFESSIONNELLE THIBAR THIBAR,EDUCATION NATIONALE,ADMINISTRATION,MIN. DE LA F.P ET DE L'EMPLOI,LIYCEE SECTORIEL DE LA FOMATION PROFESSIONNELLE THIBAR,BEJA
386190,SOCIETE CERAMIQUE D'ART MEDENINE,INDUSTRIEL GAZ,INDUSTRIEL GAZ,INDUSTRIEL GAZ,SOCIETE CERAMIQUE D'ART,MEDENINE
386220,HOPITAL REGIONAL TATAOUINE TATAOUINE,SANTE PUBLIQUE,ADMINISTRATION,MIN.SANTE PUB.,HOPITAL REGIONAL TATAOUINE,TATAOUINE
386250,HOMERE HOTEL ZONE TOURISTIQUE AGHIR BP162 DJERBA MIDOUN,HOTELS-RESTAURANTS,HOTELS-RESTAURANTS,HOTELS-RESTAURANTS,HOTEL HOMERE,MEDENINE
386260,HOTEL EL JAZIRA JERBA,HOTELS-RESTAURANTS,HOTELS-RESTAURANTS,HOTELS-RESTAURANTS,HOTEL EL JAZIRA,MEDENINE
386270,HOTEL PALMYRE IBEROSTAR TOZEUR HOTEL PALMYRE IBEROSTAR Z.TOURISTIQUE_TOZEUR,HOTELS-RESTAURANTS,HOTELS-RESTAURANTS,HOTELS-RESTAURANTS,HOTEL PALMYRE IBEROSTAR,TOZEUR
386280,FRAM TOURISME TUNISIE - HOTEL LES QUATRE SAISONS JERBA,HOTELS-RESTAURANTS,HOTELS-RESTAURANTS,HOTELS-RESTAURANTS,HOTEL LES QUATRE SAISONS,MEDENINE
386300,SOTUSA HAMMAMET,INDUSTRIEL GAZ,INDUSTRIEL GAZ,INDUSTRIEL GAZ,SOTUSA,NABEUL
386320,ECOLE PREPARATOIRE AIN JELLOULA AIN JELLOULA,COLLEGE-LYCEE-ECOLE,ADMINISTRATION,MIN.EDUC.,ECOLE PREPARATOIRE AIN JELLOULA,KAIROUAN
386340,FAOUZIA BOURKHIS STATION SERVICE AGIL CARBURATION AUTO EL KANTAOUI SOUSSE,GPL C,GPL C,GPL C,KANTAOUI,SOUSSE
386350,RIDHA BEN KHEDER S/S AGIL CARBURATION AOTO CEBELET BEN AMMAR CEBALET BEN AMMAR,GPL C,GPL C,GPL C,C.B.Ammar,ARIANA
386370,BRIGADE D'INTERVENTION NAASEN,ADMINISTRATION GAZ,ADMINISTRATION,MIN.INTER.DEV.LOC.,BRIGADE D'INTERVENTION NAASEN,BEN AROUS
386390,S.T.I.P MENZEL BOURGUIBA,INDUSTRIEL GAZ,INDUSTRIEL GAZ,INDUSTRIEL GAZ,S.T.I.P,BIZERTE
386410,REGIMENT DU QUARTIER GENERAL EL OMRANE EL OMRANE,ARMEE GAZ,ADMINISTRATION,MIN.DEF.NAT.,REGIMENT DU QUARTIER GENERAL EL OMRANE EL OMRANE,TUNIS
386460,TAOUFIK JERBI STATION SERVICE AGIL CARBURATION AUTO S/S CARBURATION AUTO SALTNIA KM3 SFAX,GPL C,GPL C,GPL C,POUDRIERE 2 GPL,SFAX
386500,COMMISSARIAT GENERAL DE LA JEUNESSE ET DE L'ENFANCE DE BIZERTE BIZERTE,COLLEGE-LYCEE-ECOLE,ADMINISTRATION,MIN.EDUC.,COMMISSARIAT GENERAL DE LA JEUNESSE ET DE L'ENFANCE DE BIZERTE,BIZERTE
386520,CENTRE DE REEDUCATION DES MINEURS EL MOUROUJ 1 EL MOUROUJ 1,COLLEGE-LYCEE-ECOLE,ADMINISTRATION,MIN.JUSTICE DROITS HOMME,CENTRE DE REEDUCATION DES MINEURS EL MOUROUJ 1,BEN AROUS
386560,ECOLE DE FORMATION DE SOUS OFFICIERS DE POLICE ADJOINT BIZERTE,COLLEGE-LYCEE-ECOLE,ADMINISTRATION,MIN.INTER.DEV.LOC.,ECOLE DE FORMATION DE SOUS OFFICIERS DE POLICE ADJOINT BIZERTE,BIZERTE
386570,FUBA PRINTED CIRCUITS TUNISIE,INDUSTRIEL GAZ,INDUSTRIEL GAZ,INDUSTRIEL GAZ,FUBA PRINTED CIRCUITS TUNISIE,TUNIS
386590,AEROPORT TABARKA,DIVERS GAZ,DIVERS GAZ,DIVERS GAZ,AEROPORT TABARKA,JENDOUBA
386600,COMPLEXE HOTELIER ET IMMOBILIER DJERBA EL HANA JERBA,HOTELS-RESTAURANTS,HOTELS-RESTAURANTS,HOTELS-RESTAURANTS,HOTEL DJERBA EL HANA,MEDENINE
386610,CENTRE DE FORMATION PROFF. FORESTIERE RIMEL,COLLEGE-LYCEE-ECOLE,ADMINISTRATION,MIN.AGRIC.ENV.RESS.HYD.,CENTRE DE FORMATION PROFF. FORESTIERE RIMEL,BIZERTE
386620,SOCIETE MATUBO MENZEL JEMIL,INDUSTRIEL GAZ,INDUSTRIEL GAZ,INDUSTRIEL GAZ,SOCIETE MATUBO MENZEL JEMIL,BIZERTE
386640,CITE UNIVERSITAIRE MATEUR,EDUCATION NATIONALE,ADMINISTRATION,MIN.ENS.SUP.RECH.SC.,CITE UNIVERSITAIRE MATEUR,BIZERTE
386710,LYCEE PILOTE GAFSA GAFSA,EDUCATION NATIONALE,ADMINISTRATION,MIN.EDUC.,LYCEE PILOTE GAFSA,GAFSA
386740,BOUCHAMAOUI ZONE INDUST. LA CHARGUIA,INDUSTRIEL GAZ,INDUSTRIEL GAZ,INDUSTRIEL GAZ,BOUCHAMAOUI,GABES
386790,DIRECTION GENERALE DES TRAVAUX EL AOUINA,ARMEE GAZ,ADMINISTRATION,MIN.DEF.NAT.,DIRECTION GENERALE DES TRAVAUX EL AOUINA,TUNIS
386830,SOCIETE EL MOSTAKBEL DE DISTRIBUTION S/S AGIL-ZARZOUNA ZARZOUNA BIZERTE,GPL C,GPL C,GPL C,ZARZOUNA,BIZERTE
386860,FACULTE DES SCIENCES BIZERTE BIZERTE,COLLEGE-LYCEE-ECOLE,ADMINISTRATION,MIN.ENS.SUP.RECH.SC.,FACULTE DES SCIENCES BIZERTE,BIZERTE
386870,CENTRE DE FORMATION PROFF. DES PECHES ANCIEN PORT GHAR EL MELH,COLLEGE-LYCEE-ECOLE,ADMINISTRATION,MIN.AGRIC.ENV.RESS.HYD.,CENTRE DE FORMATION PROFF. DES PECHES ANCIEN PORT GHAR EL MELH,BIZERTE
386880,RESTAURANT UNIVERSITAIRE ROUTE MENZEL ABDERRAHMEN BIZERTE ROUTE MENZEL ABDERRAHMEN BIZERTE,EDUCATION NATIONALE,ADMINISTRATION,MIN.ENS.SUP.RECH.SC.,RESTAURANT UNIVERSITAIRE ROUTE MENZEL ABDERRAHMEN,BIZERTE
386910,COMECAB ZONE INDUSTRIELLE RADES,INDUSTRIEL GAZ,INDUSTRIEL GAZ,INDUSTRIEL GAZ,COMECAB,BEN AROUS
386990,HOTEL EDEN BEACH ZONE TOURISTIQUE ZARZIS,HOTELS-RESTAURANTS,HOTELS-RESTAURANTS,HOTELS-RESTAURANTS,HOTEL EDEN BEACH,MEDENINE
387010,METAL PRODUCTION GP 3 KM 27 JEBEL OUEST,INDUSTRIEL GAZ,INDUSTRIEL GAZ,INDUSTRIEL GAZ,METAL PRODUCTION,ZAGHOUAN
387020,"INSTITUT SUPERIEUR DES ETUDES TECHNOLOGIQUES BP A88 ROUTE MAHDIA KM 2,5",EDUCATION NATIONALE,ADMINISTRATION,MIN.ENS.SUP.RECH.SC.,INSTITUT SUPERIEUR DES ETUDES TECHNOLOGIQUES,MEDENINE
387030,HOTEL LE PALAIS DES ILES DJERBA MIDOUN,HOTELS-RESTAURANTS,HOTELS-RESTAURANTS,HOTELS-RESTAURANTS,HOTEL LE PALAIS,MEDENINE
387440,STE OUR COTOURISM SERVICE HOT. ONE RESORT JERBA GOLF ET SPA ZONE TOURISTIQUE B.P 358 DJERBA,HOTELS-RESTAURANTS,HOTELS-RESTAURANTS,HOTELS-RESTAURANTS,HOTEL. ONE RESORT JERBA GOLF ET SPA,MEDENINE
387450,LES INDUSTRIES DE CHIMIE ET DE CONDITIONNEMENT REUNIS JEBEL JELOUD,INDUSTRIEL GAZ,INDUSTRIEL GAZ,INDUSTRIEL GAZ,LES INDUSTRIES DE CHIMIE ET DE CONDITIONNEMENT REUNIS,TUNIS
387460,HOTEL GIKTIS HOTEL GIKTIS ZONE TOURISTIQUE ZARZIS,HOTELS-RESTAURANTS,HOTELS-RESTAURANTS,HOTELS-RESTAURANTS,HOTEL GIKTIS,MEDENINE
387470,HOTEL LES BOUGAINVILLIERS ZONE TOURESTIQUE JERBA MIDOUN,HOTELS-RESTAURANTS,HOTELS-RESTAURANTS,HOTELS-RESTAURANTS,HOTEL LES BOUGAINVILLIERS,MEDENINE
387490,HOTEL DJERBA LES DUNES B.P 174 HOUMET SOUK DJERBA,HOTELS-RESTAURANTS,HOTELS-RESTAURANTS,HOTELS-RESTAURANTS,HOTEL DJERBA LES DUNES,MEDENINE
387500,VINCCI MEDITERRANEE - HOTEL DJERBA RESORT ZONE TOURISTIQUE MIDOUN B.P 240 DJERBA,HOTELS-RESTAURANTS,HOTELS-RESTAURANTS,HOTELS-RESTAURANTS,HOTEL DJERBA RESORT VINCCI MEDITERRANEE,MEDENINE
387550,LOTFI NAJJAR RUE ETTAHRIR EL ALIA BIZERTE,DEPOSITAIRES,DEPOSITAIRES,DEPOSITAIRES,LOTFI NAJJAR,BIZERTE
387561,WINSTAR TUNISIA B.V CENTRE LEMAN BLOC D 3`E ET 4`E ETAGE LAC,DIVERS GAZ,DIVERS GAZ,DIVERS GAZ,WINSTAR TUNISIA B.V,TUNIS
387570,SOCIETE COMMERCIALE EL HILAL RUE ABOU KACEM CHEBBI AIN DRAHAM,DEPOSITAIRES,DEPOSITAIRES,DEPOSITAIRES,SOCIETE COMMERCIALE EL HILAL ,JENDOUBA
387590,SKANDER EL KATEB HOTEL EL KANTRA PORT EL KANTAOUI H/SOUSSE,DIVERS GAZ,HOTELS-RESTAURANTS,DIVERS GAZ,HOTEL EL KANTRA,SOUSSE
387610,MOHSEN BEN SASSI 22 RUE MOHAMED ALI BEN AROUS,DEPOSITAIRES,DEPOSITAIRES,DEPOSITAIRES,MOHSEN BEN SASSI,BEN AROUS
387611,MOHSEN BEN SASSI 22 RUE MOHAMED ALI BEN AROUS,DEPOSITAIRES,DEPOSITAIRES,DEPOSITAIRES,MOHSEN BEN SASSI,BEN AROUS
387700,CITE UNIVERSITAIRE DE SBEITLA SBEITLA,EDUCATION NATIONALE,ADMINISTRATION,MIN.ENS.SUP.RECH.SC.,CITE UNIVERSITAIRE DE SBEITLA,KASSERINE
387720,LYCEE MIXTE SIDI ALI BEN NASRALLA,EDUCATION NATIONALE,ADMINISTRATION,MIN.EDUC.,LYCEE MIXTE SIDI ALI BEN NASRALLA,KAIROUAN
387760,SUNNY DAYS HOTELS TUNISIE ROUTE TOURISTIQUE DJERBA,HOTELS-RESTAURANTS,HOTELS-RESTAURANTS,HOTELS-RESTAURANTS,HOTELS SUNNY DAYS ,MEDENINE
387800,RESIDENCE AIN MERIEM RUE CORNICHE 7000 EL JALA,HOTELS-RESTAURANTS,HOTELS-RESTAURANTS,HOTELS-RESTAURANTS,HOTEL RESIDENCE AIN MERIEM,BIZERTE
387840,FOYER UNIVERSITAIRE ENNAKHIL ROUTE DE MEDENINE GABES CITE EL AMEL ZRIG,EDUCATION NATIONALE,ADMINISTRATION,MIN.ENS.SUP.RECH.SC.,FOYER UNIVERSITAIRE ENNAKHIL,GABES
387870,"RESTAURANT UNIVERSITAIRE ALI CHARFI RTE DE MAHDIA KM 2,5 EL BOUSTEN SFAX",EDUCATION NATIONALE,ADMINISTRATION,MIN.ENS.SUP.RECH.SC.,RESTAURANT UNIVERSITAIRE ALI CHARFI,SFAX
387900,CAZERNE MILITAIRE MEKNASSY,ARMEE GAZ,ADMINISTRATION,MIN.DEF.NAT.,CASERNE MILITAIRE MEKNASSY,SIDI BOUZID
387910,SOCIETE ZID EL FOUDHAYLI ET FILS RUE 2MARS 1934- TATAOUINE,DEPOSITAIRES,DEPOSITAIRES,DEPOSITAIRES,SOCIETE ZID EL FOUDHAYLI ET FILS,TATAOUINE
387920,CASERNE MILITAIRE EL AOUINET,ARMEE GAZ,ADMINISTRATION,MIN.DEF.NAT.,CASERNE MILITAIRE EL AOUINET,GABES
387950,IDEAL CERAM ET CIES ARTISANAT ROUTE DE MAHDIA KM 10 SFAX,INDUSTRIEL GAZ,INDUSTRIEL GAZ,INDUSTRIEL GAZ,IDEAL CERAM ET CIES ARTISANAT,SFAX
388010,MONGI DOUKHALI CEBALET MORNAG,DEPOSITAIRES,DEPOSITAIRES,DEPOSITAIRES,MONGI DOUKHALI,BEN AROUS
388030,"SOCIETE FARMER 67,RUE ALAIN SAVARY TUNIS",INDUSTRIEL GAZ,INDUSTRIEL GAZ,INDUSTRIEL GAZ,SOCIETE FARMER,TUNIS
388060,HOTEL ISIS ROUTE TOURISTIQUE,HOTELS-RESTAURANTS,HOTELS-RESTAURANTS,HOTELS-RESTAURANTS,HOTEL ISIS,MEDENINE
388070,CHAKER BEN BELGACEM DHAOUI CITE EL KHADRA SIDI BOUZID,DEPOSITAIRES,DEPOSITAIRES,DEPOSITAIRES,CHAKER BEN BELGACEM DHAOUI,SIDI BOUZID
388080,SOCIETE NOUVELLE DE BOISSONS AVENUE HABIB BOURGUIBA LA MORNAGUIA,INDUSTRIEL GAZ,INDUSTRIEL GAZ,INDUSTRIEL GAZ,SOCIETE NOUVELLE DE BOISSONS,MANOUBA
388090,HOTEL BIZERTA RESORT ROUTE DE LA CORNICHE BP 246,HOTELS-RESTAURANTS,HOTELS-RESTAURANTS,HOTELS-RESTAURANTS,HOTEL BIZERTA RESORT,BIZERTE
388151,VENTES MATERIELS GAZ DIVERS TUNIS,REVENDEVEUR,REVENDEVEUR,REVENDEVEUR,VENTES MATERIELS GAZ,TUNIS
388241,OUANNES ABDA ZOUHOUR 5,REVENDEVEUR,REVENDEVEUR,REVENDEVEUR,OUANNES ABDA,TUNIS
388441,SAADALLAH BEN MAHMOUD KALAAT EL ANDALOUS,DEPOSITAIRES,DEPOSITAIRES,DEPOSITAIRES,SAADALLAH BEN MAHMOUD,TUNIS
388450,SOCIETE DES METAUX ET DU RECYCLAGE (SOMERE) RUE9042 SIDI FATHALLAH.JEBEL.EL.DJELLOUD.BP58,INDUSTRIEL GAZ,INDUSTRIEL GAZ,INDUSTRIEL GAZ,SOCIETE DES METAUX ET DU RECYCLAGE (SOMERE),TUNIS
388470,"MOHAMED BEN AMMAR KHAZRAOUI RUE,ETTABARI- MARETH- GABES",DEPOSITAIRES,DEPOSITAIRES,DEPOSITAIRES,MOHAMED BEN AMMAR KHAZRAOUI,GABES
388490,CITE UNIVERSITAIRE IBN JAZZAR RUE ASSAD IBN FOURAT KAIROUAN,EDUCATION NATIONALE,ADMINISTRATION,MIN.ENS.SUP.RECH.SC.,CITE UNIVERSITAIRE IBN JAZZAR,KAIROUAN
